Name,Number,Full_Name,Number_of_GenEd,Gen_Ed_1,Gen_Ed_2
MEJO,374,Communications Consulting,0,,
MEJO,430,Personal Finance,0,,
MEJO,353,Sports Production and Broadcasting Practicum,0,,
MEJO,437,Media in Asia,0,,
MEJO,479H,Market Intelligence,1,FC-QUANT,
MEJO,437H,Media in Asia,0,,
MEJO,447H,Media in the United Kingdom,1,FC-GLOBAL,
MEJO,352,Sports Production and Broadcasting,0,,
MEJO,439,Producing for Advertising,0,,
MEJO,438,Advertising in the Age of Alexa,0,,
MEJO,432,Cause Communications,0,,
MEJO,142,Cultural Competency in Journalism and Strategic Communication,1,FC-KNOWING or FC-POWER,
MEJO,500,Freelance Fundamentals,0,,
MNGT,330,Economic History of the United States,0,,
MNGT,345,Public Policy Toward Business,1,FC-KNOWING,
MNGT,380,The Economics of Labor Relations,0,,
MNGT,223,Small Group Communication,1,FC-VALUES,
MNGT,365,The Worker and American Life,0,,
MNGT,415,Economy and Society,0,,
MNGT,410,Formal Organizations and Bureaucracy,1,FC-POWER,
MNGT,131,Social Relations in the Workplace,0,,
MNGT,310,Microeconomics: Theory and Applications,0,,
MNGT,412,Social Stratification,0,,
MNGT,120,Introduction to Interpersonal and Organizational Communication,0,,
MNGT,427,The Labor Force,1,FC-POWER,
MNGT,364,History of American Business,1,FC-PAST or FC-POWER,
MNGT,325,Introduction to Organizational Communication,1,FC-KNOWING,
MNGT,325H,Introduction to Organizational Communication,1,FC-KNOWING,
MNGT,120H,Introduction to Interpersonal and Organizational Communication,0,,
MUSC,141,Survey of Western Music History,1,FC-AESTH or FC-PAST,
MUSC,56,First-Year Seminar: Early-Modern Court Spectacle,0,,
MUSC,355,History and Culture of Music,0,,
MUSC,202,Advanced Individual Lessons in Voice,0,,
MUSC,147,Introduction to the Music of the Amricas,1,FC-POWER,
MUSC,188,Introduction to Women and Music,1,FC-AESTH or FC-POWER,
MUSC,131,Tonal Theory I,0,,
MUSC,144,Introduction to Country Music,1,FC-AESTH,
MUSC,125,Diction for Singers III (German),0,,
MUSC,132,Tonal Theory II,1,FC-AESTH,
MUSC,145,Introduction to Jazz,1,FC-AESTH,
MUSC,331,Musical Form and Analysis,0,,
MUSC,267,Orchestration,0,,
MUSC,261,Music Production II,0,,
MUSC,121,Fundamentals of Tonal Music I,1,FC-AESTH,
MUSC,122,Fundamentals of Music II,0,,
MUSC,104,Individual Woodwind Lessons,0,,
MUSC,102,Individual Voice Lessons,0,,
MUSC,143,Introduction to Rock Music,1,FC-AESTH,
MUSC,142,Great Musical Works,1,FC-AESTH,
MUSC,100,Individual Keyboard Lessons,0,,
MUSC,105,Individual Brass Lessons,0,,
MUSC,103,Individual String Lessons,0,,
MUSC,124,Diction for Singers II (French),0,,
MUSC,136,Keyboard Skills I,0,,
MUSC,148,Introduction to Black Music,1,FC-AESTH,
MUSC,155,The Art and Culture of the DJ,0,,
MUSC,166,Introduction to Composition,0,,
MUSC,168,Basic Conducting,0,,
MUSC,332,Counterpoint,0,,
MUSC,133,Tonal Musicianship Skills II,0,,
MUSC,158,Rock Lab,0,,
MUSC,130,Tonal Musicianship Skills I,0,,
MUSC,206,Advanced Individual Lessons in Percussion,0,,
MUSC,214,Chamber Music,0,,
MUSC,251,Studies in Medieval and Early Modern Music,1,FC-CREATE or FC-GLOBAL,
MUSC,265,Jazz Composition and Arranging,0,,
MUSC,333,Analysis of Popular Music,0,,
MUSC,200,Advanced Individual Lessons in Keyboard,0,,
MUSC,207,Advanced Applied Instruction,0,,
MUSC,266,Composition,1,FC-CREATE,
MUSC,135,Jazz Theory,0,,
MUSC,146,Introduction to World Musics,1,FC-AESTH or FC-GLOBAL,
MUSC,156,Beat Making Lab,0,,
MUSC,281,Popular Song in American Culture,0,,
MUSC,112,Group Lessons in Strings,0,,
MUSC,113,Group Lessons in Woodwinds,0,,
MUSC,211,Ensemble I,0,,
MUSC,213,Ensemble III,0,,
MUSC,212,Ensemble II,0,,
MUSC,106,Individual Percussion Lessons,0,,
MUSC,283,Haydn and Mozart,0,,
MUSC,89,First-Year Seminar: Special Topics,0,,
MUSC,120,Foundations in Music,0,,
MUSC,163,Jazz Improvisation I,0,,
MUSC,167,Instrumentation,0,,
MUSC,111,Group Lessons in Voice,0,,
MUSC,115,Group Lessons in Percussion,0,,
MUSC,284,Beethoven and His Era,0,,
MUSC,296,Special Studies for Undergraduates,0,,
MUSC,288,The Orchestra and Its Music,0,,
MUSC,114,Group Lessons in Brass,0,,
MUSC,54,First-Year Seminar: Music and Magic,0,,
MUSC,57,First-Year Seminar: Music and Drama: Verdi's Operas and Italian Romanticism,0,,
MUSC,240,"Performance in Southeast Asia: Gongs, Punks, and Shadow Plays",0,,
MUSC,300,Advanced Keyboard Lessons and Recital,1,FC-CREATE,
MUSC,110,Group Lessons in Piano,0,,
MUSC,157,Rap Lab,0,,
MUSC,309,Advanced Lessons in Conducting,0,,
MUSC,286,Music as Culture,1,FC-AESTH,
MUSC,285,Musical Modernism,0,,
MUSC,123,Diction for Singers I (English/Italian),0,,
MUSC,287,Opera as Drama,1,FC-AESTH,
MUSC,161,Music Production I,0,,
MUSC,471,Instrumental Performance Repertory,0,,
MUSC,203,Advanced Individual Lessons in Strings,0,,
MUSC,204,Advanced Individual Lessons in Woodwinds,0,,
MUSC,205,Advanced Individual Lessons in Brass,0,,
MUSC,232,Theory III,0,,
MUSC,338,Analysis of Music since 1900,0,,
MUSC,258,"Musical Movements: Migration, Exile, and Diaspora",1,FC-GLOBAL,
MUSC,234,World Musics in Theory and Practice,1,FC-AESTH or FC-GLOBAL,
MUSC,63,First-Year Seminar: Music on Stage and Screen,0,,
MUSC,363,Studies in Jazz,0,,
MUSC,239,Introduction to Music Technology,0,,
MUSC,308,Intermediate Lessons in Conducting,0,,
MUSC,236,Keyboard Skills II,0,,
MUSC,280,Jazz Innovators,0,,
MUSC,226,"Woodwinds, Brass, Percussion, and Strings Techniques",0,,
MUSC,230,Tonal Musicianship Skills III,0,,
MUSC,248,Gender on the Musical Stage,1,FC-AESTH or FC-POWER,
MUSC,227,"Keyboard, Vocal, and Elementary Music Techniques",0,,
MUSC,228,Principles of Teaching Music,0,,
MUSC,263,Jazz Improvisation II,0,,
MUSC,51,First-Year Seminar: The Interplay of Music and Physics,1,FC-AESTH or FC-NATSCI,
MUSC,52,"First-Year Seminar: Building a Nation: The Stage Musicals of Rodgers and Hammerstein, 1942-1949",0,,
MUSC,131H,Tonal Theory I,0,,
MUSC,132H,Tonal Theory II,1,FC-AESTH,
MUSC,53,"First-Year Seminar: Rock 'n' Roll: The First Wave, 1955-1964",0,,
MUSC,55H,First-Year Seminar: A Love Affair in Renaissance Drama and Music,0,,
MUSC,58,First-Year Seminar: Music in Motion: American Popular Music and Dance,0,,
MUSC,59,First-Year Seminar: 20th-Century Music and Visual Art,0,,
MUSC,60H,First-Year Seminar: American Literature and Its Music,0,,
MUSC,61H,First-Year Seminar: Reverberations,0,,
MUSC,62H,First-Year Seminar: Vienna: City of Dreams,0,,
MUSC,107,Applied Instruction,0,,
MUSC,282,Bach and Handel,0,,
MUSC,390H,Honors Seminar in Music,0,,
MUSC,232H,Theory III,0,,
MUSC,289,Sounds of War and Revolution,0,,
MUSC,164,Music of South Asia,1,FC-AESTH or FC-KNOWING,
MUSC,63H,First-Year Seminar: Music on Stage and Screen,0,,
MUSC,302,Advanced Voice Lessons and Recital,1,FC-CREATE,
MUSC,303,Advanced String Lessons and Recital,1,FC-CREATE,
MUSC,304,Advanced Woodwind Lessons and Recital,0,,
MUSC,305,Advanced Brass Lessons and Recital,1,FC-CREATE,
MUSC,306,Advanced Percussion Lessons and Recital,1,FC-CREATE,
MUSC,64,First-Year Seminar: What is a Work of Art? Listening to Music,0,,
MUSC,233,Studies in Performance Practices,0,,
MUSC,269,Music in the Community,1,FC-GLOBAL,
MUSC,245,Dance in Indonesia,0,,
MUSC,62,First-Year Seminar: Vienna: City of Dreams,0,,
MUSC,390,Seminar in Music,0,,
MUSC,65,First-Year Seminar: Music and Culture: Understanding the World through Music,0,,
MUSC,89H,First-Year Seminar: Special Topics,0,,
MUSC,364,UNC Summer Jazz Workshop,0,,
MUSC,254,"Studies in Music History I, Antiquity to 1750",0,,
MUSC,255,"Studies in Music History II, 1750 to the Present",1,FC-PAST,
MUSC,223,Piano Literature,0,,
MUSC,225,Vocal Pedagogy,0,,
MUSC,493,Music Internship,0,,
MUSC,291,Music and Politics,1,FC-AESTH,
MUSC,224,Piano Pedagogy,0,,
MUSC,307,Advanced Composition/Recital,1,FC-CREATE,
MUSC,200H,Advanced Individual Lessons in Keyboard,0,,
MUSC,202H,Advanced Individual Lessons in Voice,0,,
MUSC,203H,Advanced Individual Lessons in Strings,0,,
MUSC,204H,Advanced Individual Lessons in Woodwinds,0,,
MUSC,205H,Advanced Individual Lessons in Brass,0,,
MUSC,206H,Advanced Individual Lessons in Percussion,0,,
MUSC,214H,Chamber Music,0,,
MUSC,287H,Opera as Drama,1,FC-AESTH,
MUSC,302H,Advanced Voice Lessons and Recital,1,FC-CREATE,
MUSC,303H,Advanced String Lessons and Recital,1,FC-CREATE,
MUSC,304H,Advanced Woodwind Lessons and Recital,0,,
MUSC,305H,Advanced Brass Lessons and Recital,1,FC-CREATE,
MUSC,306H,Advanced Percussion Lessons and Recital,1,FC-CREATE,
MUSC,355H,History and Culture of Music,0,,
MUSC,292,Media and Social Change in Africa,0,,
MUSC,294,"Bluegrass Music, Culture, and History",0,,
MUSC,286H,Music as Culture,1,FC-AESTH,
MUSC,66,First-Year Seminar: A Course in Digital Humanities and Multimedia,0,,
MUSC,66H,First-Year Seminar: A Course in Digital Humanities and Multimedia,0,,
MUSC,381,Inside the Song: Analysis of Songcraft,0,,
MUSC,149,Introduction to Music and Dance,1,FC-AESTH,
MUSC,128,Improvisation Without Borders,0,,
MUSC,129,Aural-based Musicianship,0,,
MUSC,137,Patterns in Music,1,FC-AESTH,
MUSC,151,Introduction to the American Stage Musical,1,FC-AESTH,
MUSC,270,Critical Approaches to Music: Object Lessons,1,FC-AESTH,
MUSC,271,Critical Approaches to Music: Critical Moves,1,FC-AESTH,
MUSC,351,Critical Approaches to Music: Guided Research,0,,
MUSC,330,Advanced Study in Music Theory,1,FC-AESTH,
NAVS,101,Introduction to Naval Science,0,,
NAVS,202,Navigation,0,,
NAVS,201,Naval Leadership and Management,1,FC-KNOWING or FC-POWER,
NAVS,402,Naval Leadership and Ethics,1,FC-KNOWING or FC-VALUES,
NAVS,411,Amphibious Warfare,1,FC-CREATE or FC-POWER,
NAVS,311,Evolution of Warfare,1,FC-GLOBAL or FC-PAST,
NAVS,500,Naval Science Laboratory,0,,
NAVS,301,Naval Ships Engineering Systems,1,FC-QUANT,
NAVS,302,Naval Weapons Systems,1,FC-QUANT,
NAVS,202L,Navigation Laboratory,0,,
NAVS,401,Naval Operations,1,FC-GLOBAL,
NAVS,211,Marine Option Naval Science Laboratory,0,,
NAVS,190,Seminar in Topics of Naval Science,0,,
NAVS,196,Independent Study in Naval Science,0,,
NBIO,411,Neurobiology Laboratory Apprenticeship,0,,
NBIO,412,Neurobiology Laboratory Apprenticeship,0,,
NBIO,450,Tutorial in Neurobiology,0,,
NSCI,221,Neuropsychopharmacology,0,,
NSCI,61,First-Year Seminar: Drug Addiction: Fact and Fiction,0,,
NSCI,222,Learning,0,,
NSCI,225,Sensation and Perception,0,,
NSCI,434,Cognitive Neuroscience,0,,
NSCI,225H,Sensation and Perception,0,,
NSCI,61H,First-Year Seminar: Drug Addiction: Fact and Fiction,0,,
NSCI,175,Introduction to Neuroscience,1,FC-NATSCI,
NSCI,437,Neurobiology of Learning and Memory,0,,
NSCI,222H,Learning,0,,
NSCI,427,Neurobiology of Aging,0,,
NSCI,428,"Neuroscience, Society, and the Media",0,,
NSCI,415,History of Neuroscience,0,,
NSCI,420,Functional Neuroanatomy,0,,
NSCI,424,Neural Connections: Hands on Neuroscience,0,,
NSCI,71,First Year Seminar: Plasticity and the Brain,0,,
NSCI,423,Neurotechnology in Modern Neuroscience Research,0,,
NSCI,325,Neuroscience of Psychiatric Disorders,0,,
NSCI,405,Advanced Molecular Neuropharmacology,1,FC-CREATE,
NSCI,422,Genetics of Brain Diseases,0,,
NSCI,190,Special Topics in Neuroscience,0,,
NSCI,390,Current Topics In Neuroscience,0,,
NSCI,290,Current Topics in Neuroscience,0,,
NSCI,490,Current Topics in Neuroscience,0,,
NSCI,421,Principles of Brain Circuits,0,,
NSCI,493,Internship in Neuroscience,0,,
NSCI,490H,Current Topics in Neuroscience,0,,
NSCI,294,Service Learning in Neuroscience: APPLES,0,,
NSCI,89,First Year Seminar: Special Topics,0,,
NSCI,89H,First Year Seminar: Special Topics,0,,
NSCI,395,Independent Research,0,,
NSCI,290H,Current Topics in Neuroscience,0,,
NSCI,278,Molecular Imaging of the Brain,0,,
NSCI,276,Neural Circuits of Hunger Lab,0,,
NSCI,326,"Neuroscience Career Development, Networking & Applications in the Working World",0,,
NSCI,439,Neuroimmunology,0,,
NSCI,274,Neurophysiology Data Science Lab,0,,
NSCI,279,Microglia Laboratory,0,,
NSCI,277,Addiction Neuroscience qPCR Laboratory,0,,
NSCI,418,Glial Neuroscience,0,,
NSCI,419,Behavioral Endocrinology,1,FC-NATSCI or FC-QUANT,
NURS,496,Advanced Practicum in Nursing,0,,
NURS,497,Preparation for Professional Practice,0,,
NURS,301,Foundations of Relationship-Centered Care and Diversity and Inclusion: Carolina Core I,1,FC-POWER,
NURS,302,"Research, Ethics, and Innovation: Carolina Core  II",1,FC-VALUES,
NURS,310,Clinical Nursing Skills and Health Assessment I: On Campus Clinical I,0,,
NURS,330,Nursing Care of Adults I,0,,
NURS,351,Pathophysiology/Pharmacology Across the Lifespan I,0,,
NURS,320,Culture and Nursing Care,1,FC-GLOBAL,
NURS,352,Pathophysiology/Pharmacology Across the Lifespan II,0,,
NURS,311,Clinical Nursing Skills and Health Assessment II: On Campus Clinical II,0,,
NURS,384,Family Focused Genomic Health Care,0,,
NURS,401,"Integrating Principles of Leadership, Quality and Safety, and Informatics into Nursing Practice",0,,
NURS,402,Foundations of Population Health and Global Health: Carolina Core IV,0,,
NURS,430,Nursing Care of Adults II,0,,
NURS,410,Clinical Nursing Skills and Health Assessment III: On Campus Clinical III,0,,
NURS,481,Mental Health Promotion and Psychiatric Care Across Populations and Settings,0,,
NURS,482,Reproductive Health and Nursing Care of the Childbearing Family,0,,
NURS,483,Family-Centered Nursing Care from Birth through Adolescence,0,,
NURS,484,Public Health Nursing in Community Settings,0,,
NURS,321,Nursing Global Clinical Practicum,0,,
NURS,365,Evidence-Based Care of Older Adults,0,,
NURS,461I,Exploring Social Determinants of Health Across Populations,0,,
NURS,411,Clinical Nursing Skills and Health Assessment IV: On Campus Clinical IV,0,,
NUTR,240,Introduction to Human Nutrition,0,,
NUTR,400,Introduction to Nutritional Biochemistry,0,,
NUTR,295,Undergraduate Research Experience in Nutrition,0,,
NUTR,245,Sustainable Local Food Systems:  Intersection of Local Foods and Public Health,0,,
NUTR,175,Introduction to Food Studies: From Science to Society,1,FC-GLOBAL or FC-PAST,
NUTR,405,Fundamentals of Food and Nutrition Policy in Public Health,0,,
NUTR,470,Foundations of Nutrition Interventions,0,,
PATH,462,Experimental Pathology,0,,
PATH,426,Biology of Blood Diseases,0,,
PATH,128,Biology of Human Disease,0,,
PATH,464,Light Microscopy,0,,
PATH,426H,Biology of Blood Diseases,0,,
PHCO,154,PRIN PHCO/TOXICOL,0,,
PHCO,155,General Pharmacology,0,,
PHCO,156,General Pharmacology,0,,
PHCO,158,FUND OF DRUG ACTION,0,,
PHCY,124,Contemporary Communications in Health Care,0,,
PHCY,500,Pharmacy Bridging Course,0,,
PHCY,100,Pharmaceuticals: Ethical and Social Issues,0,,
PHIL,155,Truth and Proof: Introduction to Mathematical Logic,1,FC-QUANT,
PHIL,160,"Virtue, Value, and Happiness: An Introduction to Moral Theory",1,FC-KNOWING or FC-VALUES,
PHIL,220,17th and 18th Century Western Philosophy,1,FC-KNOWING or FC-PAST,
PHIL,272,"The Ethics of Peace, War, and Defense",1,FC-POWER or FC-VALUES,
PHIL,471,Topics in 19th Century Philosophy,0,,
PHIL,213,Asian Philosophy,1,FC-GLOBAL or FC-PAST,
PHIL,210,"Wonder, Myth, and Reason: Introduction to Ancient Greek Science and Philosophy",1,FC-KNOWING or FC-PAST,
PHIL,485,Philosophy of Art,0,,
PHIL,53,First-Year Seminar: Theories in Human Nature,0,,
PHIL,101,"Introduction to Philosophy: Central Problems, Great Minds, Big Ideas",1,FC-KNOWING or FC-VALUES,
PHIL,423,Kant's Theoretical Philosophy,1,FC-PAST,
PHIL,455,Symbolic Logic,1,FC-QUANT,
PHIL,150,"Theory, Evidence, and Understanding in Science",1,FC-KNOWING,
PHIL,470,Political Philosophy from Hobbes to Rousseau,0,,
PHIL,422,Empiricism,1,FC-KNOWING or FC-PAST,
PHIL,482,Philosophy and Literature,0,,
PHIL,460,History of Moral Philosophy,1,FC-VALUES,
PHIL,494,Existentialism and Phenomenology,0,,
PHIL,412,Plato,1,FC-PAST,
PHIL,454,"Philosophy, History, and the Social Sciences",0,,
PHIL,421,Rationalism,1,FC-KNOWING or FC-PAST,
PHIL,228,American Philosophy,0,,
PHIL,445,Advanced Philosophy of Language,1,FC-KNOWING,
PHIL,428,History of American Philosophy,0,,
PHIL,450,Philosophy of Natural Sciences,0,,
PHIL,463,Contemporary Moral and Social Problems,0,,
PHIL,397,Philosophy Research Seminar for Undergraduates,1,FC-KNOWING,
PHIL,453,Philosophy of Psychology,0,,
PHIL,456,Advanced Symbolic Logic,1,FC-QUANT,
PHIL,411,Aristotle,1,FC-PAST,
PHIL,415,Medieval Philosophy,0,,
PHIL,145,"Language, Communication, and Human and Animal Minds",1,FC-KNOWING or FC-POWER,
PHIL,396,Directed Readings,0,,
PHIL,459,Philosophy of Mathematics,0,,
PHIL,51,First-Year Seminar: Who Was Socrates?,1,FC-PAST or FC-VALUES,
PHIL,229,20th-Century Western Philosophy,0,,
PHIL,457,Set Theory and Logic,0,,
PHIL,273,"Justice, Rights, and the Common Good: Philosophical Perspectives on Social and Economic Issues",1,FC-POWER or FC-VALUES,
PHIL,101H,"Introduction to Philosophy: Central Problems, Great Minds, Big Ideas",1,FC-KNOWING or FC-VALUES,
PHIL,155H,Truth and Proof: Introduction to Mathematical Logic,1,FC-QUANT,
PHIL,368,"Living Things, Wilderness, and Ecosystems: An Introduction to Environmental Ethics",1,FC-VALUES,
PHIL,427,Hegel,0,,
PHIL,224,Existential Philosophy and the Meaning(lessness) of Life,1,FC-PAST or FC-VALUES,
PHIL,462,Contemporary Moral Philosophy,0,,
PHIL,476,Recent Developments in Political Philosophy,0,,
PHIL,432,The Beginnings of Analytic Philosophy,1,FC-KNOWING,
PHIL,215,Medieval Philosophy,1,FC-KNOWING or FC-PAST,
PHIL,134,"Reason, Faith, and God: Philosophy of Western Religion",1,FC-KNOWING or FC-VALUES,
PHIL,170,"Liberty, Rights, and Responsibilities: Introduction to Social Ethics and Political Thought",1,FC-VALUES,
PHIL,230,"Mind, Matter, and Metaphysics: the Philosophy of Experience and Reality",1,FC-KNOWING,
PHIL,185,Aesthetics and the Philosophy of Art,1,FC-AESTH,
PHIL,154,Philosophy of the Social Sciences,1,FC-KNOWING,
PHIL,335,Theory of Knowledge,1,FC-KNOWING,
PHIL,285,Moral and Philosophical Issues in Education,1,FC-POWER or FC-VALUES,
PHIL,275,Moral and Philosophical Issues of Gender in Society,1,FC-POWER or FC-VALUES,
PHIL,330,Metaphysics,1,FC-KNOWING,
PHIL,165,Bioethics,1,FC-VALUES,
PHIL,480,Philosophy of Law,0,,
PHIL,433,Current Issues in Analytic Philosophy,1,FC-KNOWING,
PHIL,266,Not All Fun and Games: Ethics of Sports,1,FC-VALUES,
PHIL,491,"Health Care, Science, and Philosophy",0,,
PHIL,160H,"Virtue, Value, and Happiness: An Introduction to Moral Theory",1,FC-KNOWING or FC-VALUES,
PHIL,150H,"Theory, Evidence, and Understanding in Science",1,FC-KNOWING,
PHIL,170H,"Liberty, Rights, and Responsibilities: Introduction to Social Ethics and Political Thought",1,FC-VALUES,
PHIL,230H,"Mind, Matter, and Metaphysics: the Philosophy of Experience and Reality",1,FC-KNOWING,
PHIL,110,Philosophical Texts that Changed the World: An Introduction to Philosophy through Great Works,1,FC-PAST or FC-VALUES,
PHIL,110H,Philosophical Texts that Changed the World: An Introduction to Philosophy through Great Works,1,FC-PAST or FC-VALUES,
PHIL,274,"Race, Racism, and Social Justice: African-American Political Philosophy",1,FC-POWER or FC-VALUES,
PHIL,440,Philosophy of Mind,0,,
PHIL,275H,Moral and Philosophical Issues of Gender in Society,1,FC-POWER or FC-VALUES,
PHIL,360,Major Developments in Ethics: Historical and Philosophical Perspectives,1,FC-VALUES,
PHIL,362,Contemporary Ethical Theory,1,FC-VALUES,
PHIL,345,Philosophy of Language,1,FC-KNOWING,
PHIL,340,Philosophy of Mind,1,FC-KNOWING,
PHIL,370,"Authority, Freedom, and Rights: Advanced Political Philosophy",1,FC-VALUES,
PHIL,390,Seminar in Selected Topics,0,,
PHIL,165H,Bioethics,1,FC-VALUES,
PHIL,134H,"Reason, Faith, and God: Philosophy of Western Religion",1,FC-KNOWING or FC-VALUES,
PHIL,163,Practical Ethics: Moral Reasoning and How We Live,1,FC-KNOWING or FC-VALUES,
PHIL,280H,"Morality, Law, and Justice: Issues in Legal Philosophy",1,FC-POWER or FC-VALUES,
PHIL,468,Risk and Society,0,,
PHIL,475,"Philosophical Issues in Gender, Race, and Class",0,,
PHIL,164,Morality and Business,1,FC-VALUES,
PHIL,112,Making Sense of Ourselves,1,FC-KNOWING or FC-VALUES,
PHIL,364,Ethics and Economics,1,FC-VALUES,
PHIL,353,Minds and Machines: Philosophy of Cognitive Science,0,,
PHIL,157,Logic and Decision Theory,1,FC-KNOWING or FC-QUANT,
PHIL,163H,Practical Ethics: Moral Reasoning and How We Live,1,FC-KNOWING or FC-VALUES,
PHIL,274H,"Race, Racism, and Social Justice: African-American Political Philosophy",1,FC-POWER or FC-VALUES,
PHIL,357,"Induction, Probability, and Confirmation",1,FC-KNOWING or FC-QUANT,
PHIL,451,Philosophy of Physics,0,,
PHIL,452,Philosophy of Biology,0,,
PHIL,473,American Political Philosophy,0,,
PHIL,384,"Gateway to Philosophy, Politics, and Economics",1,FC-VALUES,
PHIL,465,Justice in Health Care,0,,
PHIL,390H,Seminar in Selected Topics,0,,
PHIL,351,Philosophy of Physics,1,FC-KNOWING or FC-NATSCI,
PHIL,352,"Sex and Death, Life and Health, Species and Evolution: The Philosophy of Biology",1,FC-KNOWING,
PHIL,52,First-Year Seminar: Reason and Religion at the Dawn of Modern Science,0,,
PHIL,54,First-Year Seminar: Thinking about Time,1,FC-KNOWING,
PHIL,55,First-Year Seminar: Paradoxes,1,FC-KNOWING or FC-VALUES,
PHIL,56,First-Year Seminar: Abortion,0,,
PHIL,57,First-Year Seminar: Race and Affirmative Action,1,FC-POWER or FC-VALUES,
PHIL,58,First-Year Seminar: From Vengeance to Mercy: Dealing with Evil,0,,
PHIL,63,"First-Year Seminar: Mind, Brain, and Consciousness",0,,
PHIL,65,First-Year Seminar: Philosophy through Mathematics,0,,
PHIL,66,First-Year Seminar: Ethics: Theoretical and Practical,1,FC-KNOWING or FC-VALUES,
PHIL,67,First-Year Seminar: Issues in a World Society: Sports and Competition,0,,
PHIL,68,First-Year Seminar: Moral Life,1,FC-KNOWING or FC-VALUES,
PHIL,76,First-Year Seminar: Is Free Will an Illusion?,1,FC-KNOWING or FC-VALUES,
PHIL,77,First-Year Seminar: Moral Weakness and Conscience,0,,
PHIL,78,First-Year Seminar: Death as a Problem for Philosophy: Metaphysical and Ethical,0,,
PHIL,79,First-Year Seminar: Words That Bind: The Structure of Constitutions,0,,
PHIL,85,"First-Year Seminar: Reason, Religion, and Reality in the Copernican Revolution",1,FC-KNOWING,
PHIL,280,"Morality, Law, and Justice: Issues in Legal Philosophy",1,FC-POWER or FC-VALUES,
PHIL,53H,First-Year Seminar: Theories in Human Nature,0,,
PHIL,210H,"Wonder, Myth, and Reason: Introduction to Ancient Greek Science and Philosophy",1,FC-KNOWING or FC-PAST,
PHIL,261,Ethics in Action,1,FC-VALUES,
PHIL,89,First Year Seminar: Special Topics,0,,
PHIL,474,Foundations of Modern Political Philosophy,0,,
PHIL,353H,Minds and Machines: Philosophy of Cognitive Science,0,,
PHIL,282,Human Rights: Philosophical Interrogations,1,FC-PAST or FC-POWER,
PHIL,351H,Philosophy of Physics,1,FC-KNOWING or FC-NATSCI,
PHIL,112H,Making Sense of Ourselves,1,FC-KNOWING or FC-VALUES,
PHIL,185H,Aesthetics and the Philosophy of Art,1,FC-AESTH,
PHIL,362H,Contemporary Ethical Theory,1,FC-VALUES,
PHIL,105,How to Reason and Argue: An Introduction to Critical Thinking,1,FC-KNOWING or FC-QUANT,
PHIL,76H,First-Year Seminar: Is Free Will an Illusion?,1,FC-KNOWING or FC-VALUES,
PHIL,85H,"First-Year Seminar: Reason, Religion, and Reality in the Copernican Revolution",1,FC-KNOWING,
PHIL,75,First-Year Seminar: Evil,1,FC-VALUES,
PHIL,180,Philosophy of Humor,1,FC-AESTH or FC-VALUES,
PHIL,496,Advanced Directed Studies,0,,
PHIL,224H,Existential Philosophy and the Meaning(lessness) of Life,1,FC-PAST or FC-VALUES,
PHIL,292,Field Work in Philosophy: Introducing Philosophy in Primary and Secondary Schools,1,FC-KNOWING or FC-VALUES,
PHIL,355,Intermediate Mathematical Logic,0,,
PHIL,354,"Quantum Mechanics, Weirdness, and Reality",0,,
PHIL,381,Philosophy and Film,1,FC-KNOWING or FC-VALUES,
PHIL,381H,Philosophy and Film,1,FC-KNOWING or FC-VALUES,
PHIL,360H,Major Developments in Ethics: Historical and Philosophical Perspectives,1,FC-VALUES,
PHIL,59,First-Year Seminar: Proofs of the Existence of God,1,FC-KNOWING or FC-VALUES,
PHIL,145H,"Language, Communication, and Human and Animal Minds",1,FC-KNOWING or FC-POWER,
PHIL,140,Knowledge and Society,1,FC-KNOWING or FC-POWER,
PHIL,68H,First-Year Seminar: Moral Life,1,FC-KNOWING or FC-VALUES,
PHIL,140H,Knowledge and Society,1,FC-KNOWING or FC-POWER,
PHIL,220H,17th and 18th Century Western Philosophy,1,FC-KNOWING or FC-PAST,
PHIL,60,First-Year Seminar: Plato's Symposium and Its Influence on Western Art and Literature,1,FC-AESTH or FC-PAST,
PHIL,424,Kant's Practical Philosophy,1,FC-PAST,
PHIL,60H,First-Year Seminar: Plato's Symposium and Its Influence on Western Art and Literature,1,FC-AESTH or FC-PAST,
PHIL,143,AI and the Future of Humanity: Philosophical Issues about Technology and Human Survival,1,FC-KNOWING or FC-VALUES,
PHIL,143H,AI and the Future of Humanity: Philosophical Issues about Technology and Human Survival,1,FC-KNOWING or FC-VALUES,
PHIL,70,"First-Year Seminar: Gateway to Philosophy, Politics, and Economics",2,FC-POWER or FC-VALUES,FC-LAB
PHIL,211,"Perspectives on Gender, Race, and Marginality in Ancient Greek Philosophy, Science, and Medicine",1,FC-PAST or FC-POWER,
PHIL,285H,Moral and Philosophical Issues in Education,1,FC-POWER or FC-VALUES,
PHIL,61,First Year Seminar: The Self: Aspiration and Transformation,0,,
PHIL,265,"Ethics, Politics, and Technology",0,,
PHIL,426,Nietzsche,1,FC-PAST or FC-VALUES,
PHIL,62,First-Year Seminar: Philosophy with Children,1,FC-KNOWING or FC-VALUES,
PHIL,276,"Ideology, Capitalism, and Critique",1,FC-POWER or FC-VALUES,
PHIL,294,Philosophy across the Lifespan,1,FC-KNOWING or FC-VALUES,
PHIL,80,First-Year Seminar: Short Stories and Contemporary Social Problems,1,FC-KNOWING or FC-VALUES,
PHIL,251,Inductive Logic and the Scientific Method,1,FC-KNOWING or FC-QUANT,
PHIL,395,Undergraduate Research Seminar in Selected Topics,1,FC-KNOWING,
PHIL,392,Ethics Research Seminar for Undergraduates,1,FC-KNOWING or FC-VALUES,
