Name,Number,Full_Name,Number_of_GenEd,Gen_Ed_1,Gen_Ed_2
GLBL,390,Current Topics in Global Studies,0,,
GLBL,89,First-Year Seminar: Special Topics,0,,
GLBL,490,Current Topics,0,,
GLBL,181,Teaching Great Decisions I,0,,
GLBL,110,Global Policy Issues,1,FC-GLOBAL or FC-KNOWING,
GLBL,193,Global Studies Internship,0,,
GLBL,485,Comparative Development,0,,
GLBL,481,NGO Politics,1,FC-GLOBAL,
GLBL,482,Soviet and Post-Soviet Politics and Institutions,0,,
GLBL,483,Comparative Health Systems,1,FC-GLOBAL,
GLBL,484,History and Politics of Central Asia,0,,
GLBL,486,Sports and Globalization,1,FC-GLOBAL,
GLBL,382,Latin American Migrant Perspectives: Ethnography and Action,0,,
GLBL,281,Phillips Ambassadors Program,0,,
GLBL,487,Social Movements: Rethinking Globalization,1,FC-GLOBAL or FC-POWER,
GLBL,383,Global Whiteness,1,FC-GLOBAL or FC-POWER,
GLBL,450,"Social Change in Times of Crisis: Knowledge, Action, and Ontology",1,FC-KNOWING or FC-POWER,
GLBL,489,Paradigms of Development and Social Change,1,FC-POWER,
GLBL,110H,Global Policy Issues,1,FC-GLOBAL or FC-KNOWING,
GLBL,89H,First-Year Seminar: Special Topics,0,,
GLBL,401,Right Wing Populism in Global Perspective,1,FC-GLOBAL or FC-POWER,
GLBL,401H,Right Wing Populism in Global Perspective,1,FC-GLOBAL or FC-POWER,
GLBL,481H,NGO Politics,1,FC-GLOBAL,
GLBL,482H,Soviet and Post-Soviet Politics and Institutions,0,,
GLBL,486H,Sports and Globalization,1,FC-GLOBAL,
GLBL,483H,Comparative Health Systems,1,FC-GLOBAL,
GLBL,491H,Major Controversies in Human Rights,0,,
GLBL,88,"First-Year Seminar: Beg, Borrow, and Steal: The Political Economy of Aid, FDI, and Corruption",0,,
GLBL,492H,Global Food Films,0,,
GLBL,413,Socialist and Decolonial Ecologies,1,FC-GLOBAL,
GLBL,487H,Social Movements: Rethinking Globalization,1,FC-GLOBAL or FC-POWER,
GLBL,415,"Dealing with Difference: Criminal Justice, Race, and Social Movements in Globalization",0,,
GLBL,492,Global Food Films,0,,
GLBL,282,Global Gap Year Seminar,0,,
GLBL,489H,Paradigms of Development and Social Change,1,FC-POWER,
GLBL,87H,First Year Seminar: The Migratory Experience,0,,
GLBL,450H,"Social Change in Times of Crisis: Knowledge, Action, and Ontology",1,FC-KNOWING or FC-POWER,
GLBL,221,The Migratory Experience,1,FC-GLOBAL,
GLBL,300,"Apology, Forgiveness, and Reconciliation - The Case of Northern Ireland",1,FC-GLOBAL,
GREK,101,Elementary Classical Greek I,0,,
GREK,102,Elementary Classical Greek II,0,,
GREK,203,Intermediate Greek I,0,,
GREK,204,Intermediate Greek II,0,,
GREK,221,Advanced Greek I,0,,
GREK,222,Advanced Greek II,0,,
GREK,205,Introductory Greek New Testament,0,,
GREK,409,Greek New Testament,0,,
GREK,396,Special Readings in Greek Literature,0,,
GREK,351,Classical Greek Prose,0,,
GREK,352,Greek Poetry,0,,
GREK,395,Independent Research in Greek,0,,
GSLL,489,GSLL Across the Curriculum (LAC),0,,
GSLL,259,Ideology and Aesthetics: Marxism and Literature,1,FC-AESTH or FC-KNOWING,
GSLL,270,German Culture and the Jewish Question,0,,
GSLL,465,Literature of Atrocity: The Gulag and the Holocaust in the Soviet Union and Eastern Europe,0,,
GSLL,50,First-Year Seminar: Literary Fantasy and Historical Reality,1,FC-AESTH or FC-PAST,
GSLL,53,"First-Year Seminar: Early Germanic Culture: Myth, Magic, Murder, and Mayhem",0,,
GSLL,51,First-Year Seminar: Stalin and Hitler: Historical Issues in Cultural and Other Perspectives,0,,
GSLL,56,"First-Year Seminar: Germans, Jews, and the History of Anti-Semitism",1,FC-PAST or FC-POWER,
GSLL,255,"Germany and Cold War: Occupation, Division, Reunification, Renewed Conflict with Russia (1945-Today)",0,,
GSLL,55,"First-Year Seminar: Fantasies of Rome: Gladiators, Senators, Soothsayers, and Caesars",0,,
GSLL,59,First-Year Seminar: Moscow 1937: Dictatorships and Their Defenders,0,,
GSLL,60,"First-Year Seminar: Avant-Garde Cinema: History, Themes, Textures",0,,
GSLL,82,First-Year Seminar: Doctor Stories,0,,
GSLL,84,First-Year Seminar: Terror for the People: Terrorism in Russian Literature and History,0,,
GSLL,85,First-Year Seminar: Children and War,0,,
GSLL,54,"First-Year Seminar: Once upon a Fairy Tale: Fairy Tales and Childhood, Then and Now",0,,
GSLL,218,Christianity and Islam in the Middle Ages,0,,
GSLL,283,Hungarian Cinema since World War II,0,,
GSLL,63,First-Year Seminar: Performing America,0,,
GSLL,225,Popular and Pious: Early Modern Jewish Literature,1,FC-PAST or FC-VALUES,
GSLL,271,Vampires and Empires,0,,
GSLL,281,Holocaust Cinema in Eastern Europe,0,,
GSLL,88H,First-Year Seminar: Gender and Fiction in Central and Eastern Europe,0,,
GSLL,67,"First-Year Seminar: Blackness in the European Imaginary, Europe in the Black Imaginary",0,,
GSLL,68,"First-Year Seminar: Intensity, Vitality, Ecstasy: Affects in Literature, Film, and Philosophy",1,FC-KNOWING or FC-VALUES,
GSLL,260,"From Berlin to Budapest: Literature, Film, and Culture of Central Europe",0,,
GSLL,89,First-Year Seminar: Special Topics in Germanic and Slavic Languages and Literatures,0,,
GSLL,490,Topics in Germanic and Slavic Languages and Literatures,0,,
GSLL,496,Independent Readings in Germanic and Slavic/East European Studies,0,,
GSLL,280,The Dialectic of Whiteness and Blackness in Atlantic Cultures,0,,
GSLL,69,First-Year Seminar: Laughing and Crying at the Movies: Film and Experience,1,FC-AESTH,
GSLL,475,Magical Realism: Central European Literature in a Global Context,0,,
GSLL,254,"The Division of Germany, Reunification, and Conflict with Russia",0,,
GSLL,254H,"The Division of Germany, Reunification, and Conflict with Russia",0,,
GSLL,87,First-Year Seminar: Literature Confronting Totalitarianism,0,,
GSLL,68H,"First-Year Seminar: Intensity, Vitality, Ecstasy: Affects in Literature, Film, and Philosophy",1,FC-KNOWING or FC-VALUES,
GSLL,70,"First-Year Seminar: Teenage Kicks: Race, Class, and Gender in Postwar Youth Cultures",0,,
GSLL,278,"Music, Image, Text",0,,
GSLL,75,First-Year Seminar: The Book of Books: Literature and the Bible,1,FC-AESTH or FC-PAST,
GSLL,285,Dissent and Protest in Central Europe,0,,
GSLL,480,Interrogating Cultures of Fascism: Introduction to Frankfurt School's Critical Theory 1923-Present,0,,
GSLL,212,"""Game of Thrones"" and the Worlds of the European Middle Ages",1,FC-AESTH or FC-PAST,
GSLL,80,Not Just Dogs: Animals in Russian Literature,1,FC-AESTH or FC-PAST,
GSLL,269,Springtime for Hitler: Jews on Stage from Shakespeare to Mel Brooks,0,,
GSLL,268,"Cultural Trends in Post-Communist Central Europe: Search for Identity, Importance of Jewish Voices",0,,
GSLL,295,"Research, Creativity, and Innovation in the Humanities",0,,
GSLL,295H,"Research, Creativity, and Innovation in the Humanities",0,,
GSLL,272,"Poland, Russia, and Germany through the Prism of Film",0,,
GSLL,282,Afropessimism in American and European Film,0,,
GSLL,287,Into the Streets: 1968 and Dissent in Central Europe,0,,
GSLL,481,Grand Hotels and Empty Fields: Inventing Central Europe through Culture,0,,
GSLL,52,First-Year Seminar: Nature and Death: Ecological Crises in German Literature and Film,1,FC-AESTH or FC-KNOWING,
GSLL,83,"First-Year Seminar: We, Robots: Identifying with our Automated Others in Fiction and Film",0,,
GSLL,288,Graphic Medicine: The Intersection of Health and Comics,0,,
GSLL,279,A River Runs Through It: Cultural Geography Through Imaginative Literature,0,,
GSLL,273,Close Your Eyes and See a Film: The Documentary in Central Europe,1,FC-AESTH or FC-CREATE,
GSLL,286,The Upright and the Toppled: Public Lives of Monuments in Europe and the American South,1,FC-POWER,
GSLL,76,First-Year Seminar: Uncharted Territory: Underworlds in Literature and the Visual Arts,1,FC-AESTH or FC-PAST,
GSLL,274,Representing the Holocaust: Mediating Trauma in Art and Theory,1,FC-AESTH or FC-PAST,
HBEH,396,Independent Study in Health Behavior,0,,
HBEH,411,Pathways to Effective Community Engagement,0,,
HBEH,190,Special Topics in Health Behavior,0,,
HBEH,390,Special Topics in Global and Community Health,0,,
HEBR,101,Elementary Modern Hebrew I,0,,
HEBR,102,Elementary Modern Hebrew II,0,,
HEBR,203,Intermediate Modern Hebrew I,0,,
HEBR,204,Intermediate Modern Hebrew II,0,,
HEBR,305,"Advanced Composition and Conversation: Immigration, Ethnicities, and Religious Traditions",1,FC-KNOWING,
HEBR,306,Advanced Composition and Conversation: Zionism and the Hebrew Language,1,FC-KNOWING,
HIST,127,American History to 1865,1,FC-PAST or FC-POWER,
HIST,452,"The Renaissance: Italy, Birthplace of the Renaissance, 1300-1550",0,,
HIST,357,The U.S. South to 1865,0,,
HIST,453,Mediterranean Societies and Economics in the Renaissance World,0,,
HIST,225,History of Greece,1,FC-PAST,
HIST,128,American History since 1865,1,FC-PAST,
HIST,226,History of Rome,0,,
HIST,466,Modern European Intellectual History,0,,
HIST,434,Medieval England,1,FC-KNOWING or FC-PAST,
HIST,454,The Reformation,0,,
HIST,322,Technology and American Culture,0,,
HIST,463,"Germany since 1918: Politics, Society, and Culture",0,,
HIST,435,The Medieval University,0,,
HIST,237,Colonial American History to 1763,1,FC-PAST or FC-POWER,
HIST,136,"History of India, Pakistan, and Bangladesh: South Asia since 1750",0,,
HIST,358,The New South,0,,
HIST,367,North Carolina History since 1865,0,,
HIST,238,"The American Revolution, 1763-1815",1,FC-PAST or FC-POWER,
HIST,474,Britain in World Affairs: British Foreign Policy since World War II,0,,
HIST,291,Putting Literature and History in Dialogue,1,FC-AESTH or FC-PAST,
HIST,161,Russia Becomes an Empire,1,FC-PAST,
HIST,469,European Social History,0,,
HIST,372,"History of American Politics, 1932-Present",1,FC-PAST,
HIST,369,War and American Society,0,,
HIST,283,Chairman Mao's China in World History,1,FC-PAST,
HIST,139,History of Muslim Societies since 1500,1,FC-PAST,
HIST,475,History of Feminism,0,,
HIST,481,From Communists to Capitalists: Eastern Europe since 1945,0,,
HIST,162,Russia under the Last Tsars and Soviet Commissars,1,FC-GLOBAL or FC-PAST,
HIST,359,"The Early American Republic, 1789-1848",0,,
HIST,476,Religion and Ethnicity,0,,
HIST,332,Identity and Community in Modern Jewish History: The Case of Durham,0,,
HIST,158,"Early Modern European History, 1450-1815",1,FC-GLOBAL or FC-PAST,
HIST,142,Latin America under Colonial Rule,1,FC-GLOBAL or FC-PAST,
HIST,368,War and American Society to 1903,0,,
HIST,233,Native American History: The West,0,,
HIST,281,"The Pacific War, 1937-1945: Its Causes and Legacy",0,,
HIST,190,Special Topics in History,0,,
HIST,340,Ethics and Business in Africa,1,FC-PAST,
HIST,151,European History to 1650,1,FC-PAST,
HIST,205,"War, Diplomacy, and Statecraft, 1618-1815",1,FC-PAST,
HIST,254,War and Society in Early Modern Europe,1,FC-PAST,
HIST,333,Love and Politics in Early India,0,,
HIST,280,Women and Gender in Latin American History,1,FC-PAST or FC-POWER,
HIST,365,The Worker and American Life,0,,
HIST,125,The Social History of Popular Music in 20th-Century America,1,FC-PAST or FC-POWER,
HIST,500,"Gender, Empire, and Nation",1,FC-KNOWING or FC-PAST,
HIST,121,History of Religion in North America,1,FC-PAST or FC-POWER,
HIST,480,"Russia's 19th Century: Cultural Splendor, Imperial Decay",1,FC-PAST,
HIST,331,"Sex, Religion, and Violence: Revolutionary Thought in Modern South Asia",0,,
HIST,266,Global History of Warfare,1,FC-PAST,
HIST,255,Manor to Machine: The Economic Shaping of Europe,1,FC-PAST or FC-POWER,
HIST,352,The Great Depression and Its Legacies,0,,
HIST,143,Latin America since Independence,1,FC-PAST,
HIST,422,Ancient Greek Warfare,0,,
HIST,462,"Germany, 1806-1918: Politics, Society, and Culture",0,,
HIST,421,Alexander,0,,
HIST,152,European History since 1650,0,,
HIST,482,"Russia, Eurasian Empire",0,,
HIST,153,From the Bible to Broadway: Jewish History to Modern Times,1,FC-PAST,
HIST,329,An Introduction to the History of Medicine,0,,
HIST,229,The History of London 43 - 1666,1,FC-KNOWING or FC-PAST,
HIST,259,Towards Emancipation? Women in Modern Europe,1,FC-PAST or FC-POWER,
HIST,258,Modern Italy since 1848,0,,
HIST,277,The Conflict over Israel/Palestine,1,FC-GLOBAL or FC-PAST,
HIST,363,Popular Culture and American History,0,,
HIST,385,African American Women's History,1,FC-PAST or FC-POWER,
HIST,108,Introduction to Early Medieval History 500-1050,1,FC-KNOWING or FC-PAST,
HIST,278,The Trans-Atlantic Slave Trade,1,FC-GLOBAL or FC-PAST,
HIST,312,History of France and Algeria,1,FC-PAST or FC-POWER,
HIST,458,"Europe and the World Wars, 1914-1945",0,,
HIST,246,The Long Cold War: U.S. Foreign Relations in the 20th and 21st Centuries,1,FC-GLOBAL or FC-PAST,
HIST,76,First-Year Seminar: Understanding 1492,0,,
HIST,279,Modern South Africa,1,FC-PAST or FC-POWER,
HIST,490,Special Topics in History,0,,
HIST,425,"Roman History, 154 BCE-14 CE",0,,
HIST,107,Medieval History,1,FC-KNOWING or FC-PAST,
HIST,260,From Kings to Communists: East-Central Europe in the Modern Era,1,FC-GLOBAL or FC-PAST,
HIST,106,Ancient History,1,FC-PAST,
HIST,366,North Carolina History before 1865,0,,
HIST,373,The United States in World War II,0,,
HIST,334,"Rasputin's Russia: Erotic, Decadent, Revolutionary",0,,
HIST,105,Empires in World History,0,,
HIST,275,African History to 1800,0,,
HIST,362,Baseball and American History,1,FC-PAST,
HIST,374,"The American West, 1800 to the Present",0,,
HIST,272,Modern South Asia,0,,
HIST,273,"Water, Conflict, and Connection in the Middle East",1,FC-GLOBAL or FC-PAST,
HIST,287,Modern Japan,0,,
HIST,210,Global Issues and Globalization,1,FC-GLOBAL or FC-POWER,
HIST,479,History of Female Sexualities,0,,
HIST,360,Ideas in Modern America,1,FC-PAST or FC-POWER,
HIST,256,"France, 1940 to the Present",1,FC-PAST,
HIST,212,History of Sea Power,0,,
HIST,140,The World since 1945,1,FC-GLOBAL or FC-PAST,
HIST,289,America in the 1970s,1,FC-PAST or FC-POWER,
HIST,159,From War to Prosperity: 20th-Century Europe,1,FC-PAST,
HIST,133,Introduction to Chinese History,1,FC-GLOBAL or FC-PAST,
HIST,134,Modern East Asia,0,,
HIST,138,History of Muslim Societies to 1500,0,,
HIST,364,History of American Business,1,FC-PAST or FC-POWER,
HIST,288,Japan in the 20th Century,0,,
HIST,427,"The Early Roman Empire, 14 CE-193 CE",0,,
HIST,428,"The Later Roman Empire, 193 CE-378 CE",0,,
HIST,423,"Archaic Greece, 800-480 BCE",0,,
HIST,477,"Revolution in Russia, 1900-1930",0,,
HIST,478,"Stalin and After: The USSR, 1929-Present",0,,
HIST,264,Gender in Russian History,0,,
HIST,213,Air Power and Modern Warfare,0,,
HIST,231,Native American History: The East,1,FC-KNOWING or FC-PAST,
HIST,51,First-Year Seminar: Latin American Revolutions,1,FC-PAST or FC-POWER,
HIST,52,First-Year Seminar: Conflicts over Israel/Palestine,0,,
HIST,110,Introduction to the Cultures and Histories of Native North America,1,FC-PAST or FC-POWER,
HIST,135,History of the Indian Subcontinent to 1750,1,FC-KNOWING or FC-PAST,
HIST,176H,"Honors Seminar in Russian, Eurasian, and Eastern European History",0,,
HIST,177H,Honors Seminar in Early European History,0,,
HIST,178H,Honors Seminar in Modern European History,0,,
HIST,179H,Honors Seminar in American History,0,,
HIST,262,History of the Holocaust: The Destruction of the European Jews,1,FC-PAST or FC-POWER,
HIST,398,Undergraduate Seminar in History,0,,
HIST,130,Modern African History,1,FC-PAST or FC-POWER,
HIST,131,Southeast Asia to the Early 19th Century,0,,
HIST,375,History of Gender in America,0,,
HIST,376,History of African Americans to 1865,0,,
HIST,377,"History of African Americans, 1865 to Present",1,FC-PAST or FC-POWER,
HIST,235,Native America in the 20th Century,1,FC-PAST or FC-POWER,
HIST,424,Classical Greece (Sixth-Fourth Centuries BCE),0,,
HIST,207,The Global Cold War,1,FC-GLOBAL,
HIST,257,"Politics, Society, and Culture in Postwar Germany",1,FC-PAST or FC-POWER,
HIST,234,Native American Tribal Studies,1,FC-KNOWING or FC-PAST,
HIST,493,Internship in History,0,,
HIST,363H,Popular Culture and American History,0,,
HIST,276,The Modern Middle East,1,FC-GLOBAL or FC-PAST,
HIST,282,China in the World,1,FC-PAST,
HIST,53,"First-Year Seminar: Traveling to European Cities: American Writers/Cultural Identities, 1830-2000",1,FC-KNOWING or FC-PAST,
HIST,62,"First-Year Seminar: Nations, Borders, and Identities",0,,
HIST,63,"First-Year Seminar: Water, Conflict, and Connection: the Middle East and Ottoman Lands",0,,
HIST,64,First-Year Seminar: Gorbachev: The Collapse of the Soviet Empire and the Rise of the New Russia,0,,
HIST,66,"First-Year Seminar: Film and History in Europe and the United States, 1908-1968",0,,
HIST,70,First-Year Seminar: Seeing History in Everyday Places: Chapel Hill as a Case Study,0,,
HIST,354,War and Gender in Movies,0,,
HIST,390,Special Topics in History,0,,
HIST,495,Directed Readings in History,0,,
HIST,236,Sex and American History,1,FC-PAST or FC-POWER,
HIST,431,The Medieval Church,0,,
HIST,306,"Princes and Reformations in Germany, 1400-1600",1,FC-PAST,
HIST,307,"War and Enlightenment in Germany, 1600-1815",1,FC-PAST,
HIST,89,First Year Seminar:  Special Topics,0,,
HIST,203,Empires and Cultures in the Modern World,1,FC-PAST,
HIST,228,Medieval Science,1,FC-KNOWING or FC-PAST,
HIST,355,American Women's History to 1865,0,,
HIST,356,"American Women's History, 1865 to the Present",0,,
HIST,72,First-Year Seminar: Women's Voices: 20th-Century European History in Female Memory,1,FC-PAST or FC-POWER,
HIST,79,First-Year Seminar: Coming of Age in 20th Century America,0,,
HIST,390H,Special Topics in History,0,,
HIST,372H,"History of American Politics, 1932-Present",1,FC-PAST,
HIST,313,Women and the Law in Africa and the Middle East,1,FC-GLOBAL or FC-PAST,
HIST,83,First-Year Seminar: African History through Popular Music,0,,
HIST,84,"First-Year Seminar: Monsters, Murders, and Mayhem in Microhistorical Analysis: French Case Studies",0,,
HIST,284,Late Imperial China,0,,
HIST,285,20th-Century China,1,FC-GLOBAL or FC-PAST,
HIST,432,The Crusades,0,,
HIST,248,Guerrillas and Counterinsurgencies in Latin America,0,,
HIST,315,Nation-Building in Latin America,1,FC-GLOBAL or FC-PAST,
HIST,354H,War and Gender in Movies,0,,
HIST,377H,"History of African Americans, 1865 to Present",1,FC-PAST or FC-POWER,
HIST,335,Cracking India: Partition and Its Legacy in South Asia,1,FC-GLOBAL or FC-PAST,
HIST,241,History of Latinos in the United States,0,,
HIST,101,"A History of Lies, Conspiracies, and Misinformation",1,FC-KNOWING or FC-PAST,
HIST,120,Sport and American History,1,FC-PAST or FC-POWER,
HIST,124,United States History through Film,1,FC-POWER,
HIST,137,"Muhammad to Malcolm X: Islam, Politics, Race, and Gender",1,FC-PAST,
HIST,144,Women in the United States from Settlement to Present,1,FC-PAST or FC-POWER,
HIST,163,Modern Central Asia,1,FC-KNOWING or FC-PAST,
HIST,166,History of Afghanistan,0,,
HIST,206,"War, Diplomacy, and Statecraft, 1815-1945",1,FC-PAST,
HIST,220,The Olympic Games: A Global History,1,FC-GLOBAL or FC-PAST,
HIST,239,Religion in North America since 1865,0,,
HIST,244,History of the American Presidency,1,FC-PAST,
HIST,245,"The United States and the Cold War: Origins, Development, Legacy",1,FC-GLOBAL or FC-PAST,
HIST,249,Modern Global Christianity,1,FC-PAST,
HIST,251,The Thirty Years War (1618-1648): Europe in an Age of Crisis,1,FC-PAST or FC-POWER,
HIST,252,"Politics, Society, and Culture in Modern Germany (1871-1945)",1,FC-PAST or FC-POWER,
HIST,261,"France, 1870-1940",0,,
HIST,269,"Modern London: Empire, Race, and Culture",0,,
HIST,325,Food and History,0,,
HIST,330,Jesus and the Jews: From the Bible to the Big Screen,0,,
HIST,350,Environmental History and Computer Science: Mapping the Black Sea,0,,
HIST,361,"Lesbian, Gay, Bisexual, and Transgender Histories in the United States",0,,
HIST,240,Introduction to Mexico: A Nation in Four Revolutions,1,FC-GLOBAL or FC-PAST,
HIST,242,United States-Latin American Relations,1,FC-GLOBAL or FC-PAST,
HIST,490H,Special Topics in History,0,,
HIST,462H,"Germany, 1806-1918: Politics, Society, and Culture",0,,
HIST,463H,"Germany since 1918: Politics, Society, and Culture",0,,
HIST,89H,First Year Seminar:  Special Topics,0,,
HIST,271,Ancient and Medieval Japanese History and Culture,1,FC-GLOBAL or FC-PAST,
HIST,247,Early Modern Japanese History and Culture,1,FC-GLOBAL or FC-PAST,
HIST,234H,Native American Tribal Studies,1,FC-KNOWING or FC-PAST,
HIST,302H,Movies Make History: Films as Primary Sources in Europe and America,1,FC-AESTH or FC-PAST,
HIST,437,Aristocratic Culture in the Central Middle Ages,1,FC-KNOWING or FC-PAST,
HIST,438,"Medieval Masculinities, 500-1200",1,FC-KNOWING or FC-PAST,
HIST,145,Latin American Indigenous Peoples,1,FC-PAST,
HIST,72H,First-Year Seminar: Women's Voices: 20th-Century European History in Female Memory,1,FC-PAST or FC-POWER,
HIST,174H,"Honors Seminar in African, Asian, and Middle Eastern History",0,,
HIST,175H,Honors Seminar in Latin American History,0,,
HIST,309,"Old Regime France, 1661-1787",0,,
HIST,310,The French Revolution,0,,
HIST,459,Global Evangelicalism since 1600,0,,
HIST,438H,"Medieval Masculinities, 500-1200",1,FC-KNOWING or FC-PAST,
HIST,164,Victorian Britain: From Slavery to South African War,1,FC-KNOWING or FC-PAST,
HIST,165,20th Century Britain: from the Great War to Brexit,1,FC-KNOWING or FC-PAST,
HIST,274,"History of the Ottoman Empire, 1300-1923",1,FC-GLOBAL or FC-PAST,
HIST,308,The Renaissance and the Jews,0,,
HIST,483,Nation and Religion in Russia,0,,
HIST,485,From Fiddler on the Roof to the Holocaust: East European and Soviet Jewish History,0,,
HIST,484,Islam in Tsarist and Soviet Russia,0,,
HIST,302,Movies Make History: Films as Primary Sources in Europe and America,1,FC-AESTH or FC-PAST,
HIST,360H,Ideas in Modern America,1,FC-PAST or FC-POWER,
HIST,496,Independent Research in History,0,,
HIST,329H,An Introduction to the History of Medicine,0,,
HIST,74,"First-Year Seminar: Emperors, Courts, and Consumption: The Mughals of India",1,FC-GLOBAL or FC-PAST,
HIST,330H,Jesus and the Jews: From the Bible to the Big Screen,0,,
HIST,347,"Fascist Challenge in Europe, 1918-1945",0,,
HIST,475H,History of Feminism,0,,
HIST,85,First-Year Seminar: What Concentration Camp Survivors Tell Us,0,,
HIST,320,"Art, History, and the Modern Museum",1,FC-AESTH or FC-PAST,
HIST,230,Why History Matters to Public Policy,1,FC-PAST,
HIST,383,"Big-Time College Sports and the Rights of Athletes, 1874 to the Present",0,,
HIST,81,"First-Year Seminar: Diaries, Memoirs, and Testimonies of the Holocaust",0,,
HIST,486,"Extremism, Terrorism, and Security in Postwar Europe",0,,
HIST,442,"Religion, Co-existence, and Conflict in Pre-Colonial India",0,,
HIST,440,Gender in Indian History,0,,
HIST,243,The United States and Africa,1,FC-GLOBAL or FC-PAST,
HIST,243H,The United States and Africa,1,FC-GLOBAL or FC-PAST,
HIST,349,Comparative Empires in the Modern World,0,,
HIST,382,The History of the Civil Rights Movement,1,FC-POWER or FC-VALUES,
HIST,384,America in the Sixties,1,FC-PAST or FC-POWER,
HIST,384H,America in the Sixties,1,FC-PAST or FC-POWER,
HIST,340H,Ethics and Business in Africa,1,FC-PAST,
HIST,63H,"First-Year Seminar: Water, Conflict, and Connection: the Middle East and Ottoman Lands",0,,
HIST,353,"Cinema, Culture, and Society",0,,
HIST,348,History of Migration,0,,
HIST,346,Dictators in the 20th Century,0,,
HIST,84H,"First-Year Seminar: Monsters, Murders, and Mayhem in Microhistorical Analysis: French Case Studies",0,,
HIST,396H,Independent Study in History,0,,
HIST,398H,Undergraduate Seminar in History,0,,
HIST,278H,The Trans-Atlantic Slave Trade,1,FC-GLOBAL or FC-PAST,
HIST,85H,First-Year Seminar: What Concentration Camp Survivors Tell Us,0,,
HIST,486H,"Extremism, Terrorism, and Security in Postwar Europe",0,,
HIST,279H,Modern South Africa,1,FC-PAST or FC-POWER,
HIST,422H,Ancient Greek Warfare,0,,
HIST,489,The History of the 2008 Financial Crisis,1,FC-PAST,
HIST,50,First-Year Seminar: Time and the Medieval Cosmos,0,,
HIST,489H,The History of the 2008 Financial Crisis,1,FC-PAST,
HIST,429,Ancient Sexuality,0,,
HIST,456,"The Holocaust, Genocide and Historical Methodology",1,FC-PAST or FC-POWER,
HIST,395,Research Related Skills,0,,
HIST,388,Chinese Strategic Thought: Antiquity to the Present,0,,
HIST,441,Beauty and the Body in Pre-Colonial Indian History,0,,
HIST,270,Mughal India,0,,
HIST,55,First-Year Seminar: Preventing Broken Hearts in North Carolina: History and Health Care in the South,0,,
HIST,59,First-Year Seminar: Rebuilding the American South: Work and Identity in Modern History,0,,
HIST,466H,Modern European Intellectual History,0,,
HIST,352H,The Great Depression and Its Legacies,0,,
HIST,382H,The History of the Civil Rights Movement,1,FC-POWER or FC-VALUES,
HIST,263,Gender and Religion in Premodern Europe,1,FC-PAST or FC-POWER,
HIST,263H,Gender and Religion in Premodern Europe,1,FC-PAST or FC-POWER,
HIST,229H,The History of London 43 - 1666,1,FC-KNOWING or FC-PAST,
HIST,102,Introduction to Major Problems in U.S History,0,,
HIST,111,Global Food History,0,,
HIST,141,Globalization Since 1500,0,,
HIST,156,"The British Empire, 1815-1994",0,,
HIST,204,"Global Environmental Histories: People, Climate, and Landscapes",0,,
HIST,103,Introduction to Major Problems in Modern World History,0,,
HIST,104,Introduction to Major Problems in European History,0,,
HIST,129,"Modern America, 1980-2020",0,,
HIST,328,History of the Computer,0,,
HIST,344,The Global World Order from World War II to the Present,0,,
HIST,448,Gender and the Law in United States History,0,,
HIST,448H,Gender and the Law in United States History,0,,
HIST,269H,"Modern London: Empire, Race, and Culture",0,,
HIST,335H,Cracking India: Partition and Its Legacy in South Asia,1,FC-GLOBAL or FC-PAST,
HIST,220H,The Olympic Games: A Global History,1,FC-GLOBAL or FC-PAST,
HIST,314,Law and Society in Latin America,0,,
HIST,291H,Putting Literature and History in Dialogue,1,FC-AESTH or FC-PAST,
